{
  "roleId": "imported.agency.minimal-change-engineer",
  "roleVersion": "imported-783f6a72bfd7",
  "name": "Minimal Change Engineer Agent",
  "description": "Minimal Change Engineer Agent imported from agency-agents",
  "promptTemplate": "prompt.md",
  "outputSchema": "output.schema.json",
  "tags": [
    "imported",
    "agency-agents",
    "engineering",
    "minimal-change-engineer"
  ]
}
