{
  "roleId": "imported.agency.customer-service",
  "roleVersion": "imported-783f6a72bfd7",
  "name": "🎧 Customer Service Agent",
  "description": "🎧 Customer Service Agent imported from agency-agents",
  "promptTemplate": "prompt.md",
  "outputSchema": "output.schema.json",
  "tags": [
    "imported",
    "agency-agents",
    "specialized",
    "customer-service"
  ]
}
