{
  "roleId": "imported.agency.creative-strategist",
  "roleVersion": "imported-783f6a72bfd7",
  "name": "Paid Media Ad Creative Strategist Agent",
  "description": "Paid Media Ad Creative Strategist Agent imported from agency-agents",
  "promptTemplate": "prompt.md",
  "outputSchema": "output.schema.json",
  "tags": [
    "imported",
    "agency-agents",
    "paid-media",
    "creative-strategist"
  ]
}
