{
  "roleId": "imported.agency.app-store-optimizer",
  "roleVersion": "imported-783f6a72bfd7",
  "name": "App Store Optimizer Agent Personality",
  "description": "App Store Optimizer Agent Personality imported from agency-agents",
  "promptTemplate": "prompt.md",
  "outputSchema": "output.schema.json",
  "tags": [
    "imported",
    "agency-agents",
    "marketing",
    "app-store-optimizer"
  ]
}
