{
  "roleId": "imported.agency.recruitment-specialist",
  "roleVersion": "imported-783f6a72bfd7",
  "name": "Recruitment Specialist Agent",
  "description": "Recruitment Specialist Agent imported from agency-agents",
  "promptTemplate": "prompt.md",
  "outputSchema": "output.schema.json",
  "tags": [
    "imported",
    "agency-agents",
    "specialized",
    "recruitment-specialist"
  ]
}
