{
  "roleId": "imported.agency.macos-spatial-metal-engineer",
  "roleVersion": "imported-783f6a72bfd7",
  "name": "macOS Spatial/Metal Engineer Agent Personality",
  "description": "macOS Spatial/Metal Engineer Agent Personality imported from agency-agents",
  "promptTemplate": "prompt.md",
  "outputSchema": "output.schema.json",
  "tags": [
    "imported",
    "agency-agents",
    "spatial-computing",
    "macos-spatial-metal-engineer"
  ]
}
