{
  "roleId": "imported.agency.game-audio-engineer",
  "roleVersion": "imported-783f6a72bfd7",
  "name": "Game Audio Engineer Agent Personality",
  "description": "Game Audio Engineer Agent Personality imported from agency-agents",
  "promptTemplate": "prompt.md",
  "outputSchema": "output.schema.json",
  "tags": [
    "imported",
    "agency-agents",
    "game-development",
    "game-audio-engineer"
  ]
}
