{
  "roleId": "imported.agency.agentic-identity-trust",
  "roleVersion": "imported-783f6a72bfd7",
  "name": "Agentic Identity & Trust Architect",
  "description": "Agentic Identity & Trust Architect imported from agency-agents",
  "promptTemplate": "prompt.md",
  "outputSchema": "output.schema.json",
  "tags": [
    "imported",
    "agency-agents",
    "specialized",
    "agentic-identity-trust"
  ]
}
