{
  "roleId": "imported.agency.programmatic-buyer",
  "roleVersion": "imported-783f6a72bfd7",
  "name": "Paid Media Programmatic & Display Buyer Agent",
  "description": "Paid Media Programmatic & Display Buyer Agent imported from agency-agents",
  "promptTemplate": "prompt.md",
  "outputSchema": "output.schema.json",
  "tags": [
    "imported",
    "agency-agents",
    "paid-media",
    "programmatic-buyer"
  ]
}
