{
  "roleId": "imported.agency.whimsy-injector",
  "roleVersion": "imported-783f6a72bfd7",
  "name": "Whimsy Injector Agent Personality",
  "description": "Whimsy Injector Agent Personality imported from agency-agents",
  "promptTemplate": "prompt.md",
  "outputSchema": "output.schema.json",
  "tags": [
    "imported",
    "agency-agents",
    "design",
    "whimsy-injector"
  ]
}
