{
  "roleId": "rust-packager",
  "roleVersion": "1.0.0",
  "name": "Rust Packager Runner",
  "description": "Package the compiled binary, run it, and verify output correctness.",
  "promptTemplate": "prompt.md",
  "outputSchema": "output.schema.json",
  "tags": ["rust", "package", "runner", "pipeline"]
}
