{
  "roleId": "imported.agency.automation-governance-architect",
  "roleVersion": "imported-783f6a72bfd7",
  "name": "Automation Governance Architect",
  "description": "Automation Governance Architect imported from agency-agents",
  "promptTemplate": "prompt.md",
  "outputSchema": "output.schema.json",
  "tags": [
    "imported",
    "agency-agents",
    "specialized",
    "automation-governance-architect"
  ]
}
