{
  "roleId": "imported.agency.psychologist",
  "roleVersion": "imported-783f6a72bfd7",
  "name": "Psychologist Agent Personality",
  "description": "Psychologist Agent Personality imported from agency-agents",
  "promptTemplate": "prompt.md",
  "outputSchema": "output.schema.json",
  "tags": [
    "imported",
    "agency-agents",
    "academic",
    "psychologist"
  ]
}
