{
  "roleId": "imported.agency.incident-response-commander",
  "roleVersion": "imported-783f6a72bfd7",
  "name": "Incident Response Commander Agent",
  "description": "Incident Response Commander Agent imported from agency-agents",
  "promptTemplate": "prompt.md",
  "outputSchema": "output.schema.json",
  "tags": [
    "imported",
    "agency-agents",
    "engineering",
    "incident-response-commander"
  ]
}
